<?xml version="1.0" encoding="UTF-8"?>
<catalogo xmlns:xsi="http://www.w3.org/2001/XMLSchema-instance"
    xsi:noNamespaceSchemaLocation="catalogo.xsd">
    <categoria nombre="Zapatillas">
        <zapatilla id="ZAP-001" disponible="true" destacado="true">
            <nombre>Zapatilla Running Turbo</nombre>
            <precio moneda="EUR">89.99</precio>
            <stock>15</stock>
            <fechaRegistro>2025-01-10</fechaRegistro>
            <descripcion>Calzado de alta resistencia diseñado para maratones urbanos.</descripcion>
            <especificaciones>
                <tallaZaps>
                    <tallaZap>40</tallaZap>
                    <tallaZap>42</tallaZap>
                </tallaZaps>
                <material>Malla transpirable</material>
            </especificaciones>
        </zapatilla>
        <zapatilla id="ZAP-002" disponible="true" destacado="false">
            <nombre>Zapatilla Trail Explorer</nombre>
            <precio moneda="EUR">110.00</precio>
            <stock>8</stock>
            <fechaRegistro>2025-01-12</fechaRegistro>
            <descripcion>Suela de alto agarre para terrenos técnicos.</descripcion>
            <especificaciones>
                <tallaZaps>
                    <tallaZap>41</tallaZap>
                    <tallaZap>43</tallaZap>
                </tallaZaps>
                <material>Gore-Tex</material>
            </especificaciones>
        </zapatilla>
        <zapatilla id="ZAP-003" disponible="true" destacado="false">
            <nombre>Zapatilla Indoor Court</nombre>
            <precio moneda="EUR">65.00</precio>
            <stock>20</stock>
            <fechaRegistro>2025-01-15</fechaRegistro>
            <descripcion>Especial para deportes en pista cubierta.</descripcion>
            <especificaciones>
                <tallaZaps>
                    <tallaZap>43</tallaZap>
                </tallaZaps>
                <material>Goma antideslizante</material>
            </especificaciones>
        </zapatilla>
        <zapatilla id="ZAP-004" disponible="true" destacado="true">
            <nombre>Zapatilla Sprint Pro</nombre>
            <precio moneda="EUR">130.00</precio>
            <stock>5</stock>
            <fechaRegistro>2025-01-18</fechaRegistro>
            <descripcion>Máxima ligereza para velocistas.</descripcion>
            <especificaciones>
                <tallaZaps>
                    <tallaZap>42</tallaZap>
                </tallaZaps>
                <material>Fibra de carbono</material>
            </especificaciones>
        </zapatilla>
        <zapatilla id="ZAP-005" disponible="false" destacado="false">
            <nombre>Zapatilla Classic Walk</nombre>
            <precio moneda="EUR">40.00</precio>
            <stock>0</stock>
            <fechaRegistro>2025-01-20</fechaRegistro>
            <descripcion>Comodidad para el uso diario.</descripcion>
            <especificaciones>
                <tallaZaps>
                    <tallaZap>39</tallaZap>
                    <tallaZap>40</tallaZap>
                </tallaZaps>
                <material>Cuero sintético</material>
            </especificaciones>
        </zapatilla>
        <zapatilla id="ZAP-006" disponible="true" destacado="false">
            <nombre>Zapatilla Basket Star</nombre>
            <precio moneda="EUR">95.00</precio>
            <stock>12</stock>
            <fechaRegistro>2025-01-22</fechaRegistro>
            <descripcion>Amortiguación superior para saltos.</descripcion>
            <especificaciones>
                <tallaZaps>
                    <tallaZap>44</tallaZap>
                    <tallaZap>45</tallaZap>
                </tallaZaps>
                <material>Sintético reforzado</material>
            </especificaciones>
        </zapatilla>
        <zapatilla id="ZAP-007" disponible="true" destacado="false">
            <nombre>Zapatilla Tennis Ace</nombre>
            <precio moneda="EUR">75.00</precio>
            <stock>14</stock>
            <fechaRegistro>2025-01-23</fechaRegistro>
            <descripcion>Gran estabilidad para movimientos laterales.</descripcion>
            <especificaciones>
                <tallaZaps>
                    <tallaZap>41</tallaZap>
                </tallaZaps>
                <material>Goma reforzada</material>
            </especificaciones>
        </zapatilla>
        <zapatilla id="ZAP-008" disponible="true" destacado="true">
            <nombre>Zapatilla Gym Master</nombre>
            <precio moneda="EUR">80.00</precio>
            <stock>30</stock>
            <fechaRegistro>2025-01-24</fechaRegistro>
            <descripcion>Base plana ideal para levantamiento de pesas.</descripcion>
            <especificaciones>
                <tallaZaps>
                    <tallaZap>42</tallaZap>
                </tallaZaps>
                <material>Tela transpirable</material>
            </especificaciones>
        </zapatilla>
        <zapatilla id="ZAP-009" disponible="true" destacado="false">
            <nombre>Zapatilla Power Lift</nombre>
            <precio moneda="EUR">150.00</precio>
            <stock>4</stock>
            <fechaRegistro>2025-01-25</fechaRegistro>
            <descripcion>Calzado profesional de halterofilia.</descripcion>
            <especificaciones>
                <tallaZaps>
                    <tallaZap>43</tallaZap>
                </tallaZaps>
                <material>Cuero y madera</material>
            </especificaciones>
        </zapatilla>
        <zapatilla id="ZAP-010" disponible="true" destacado="false">
            <nombre>Zapatilla Cloud Foam</nombre>
            <precio moneda="EUR">60.00</precio>
            <stock>25</stock>
            <fechaRegistro>2025-01-26</fechaRegistro>
            <descripcion>Tecnología de espuma para pisada suave.</descripcion>
            <especificaciones>
                <tallaZaps>
                    <tallaZap>40</tallaZap>
                </tallaZaps>
                <material>Espuma técnica</material>
            </especificaciones>
        </zapatilla>
    </categoria>

    <categoria nombre="Ropa">
        <ropa_deportiva id="ROP-001" disponible="true" destacado="true">
            <nombre>Camiseta Compresión</nombre>
            <precio moneda="EUR">24.99</precio>
            <stock>35</stock>
            <fechaRegistro>2025-02-01</fechaRegistro>
            <descripcion>Mejora la circulación muscular durante el entrenamiento.</descripcion>
            <especificaciones>
                <tallas>
                    <talla>S</talla>
                    <talla>M</talla>
                    <talla>L</talla>
                </tallas>
                <material>Poliéster técnico</material>
            </especificaciones>
        </ropa_deportiva>
        <ropa_deportiva id="ROP-002" disponible="true" destacado="false">
            <nombre>Pantalón Corto Running</nombre>
            <precio moneda="EUR">19.95</precio>
            <stock>40</stock>
            <fechaRegistro>2025-02-01</fechaRegistro>
            <descripcion>Ligero y transpirable con detalles reflectantes.</descripcion>
            <especificaciones>
                <tallas>
                    <talla>M</talla>
                    <talla>L</talla>
                    <talla>XL</talla>
                </tallas>
                <material>Nailon de secado rápido</material>
            </especificaciones>
        </ropa_deportiva>
        <ropa_deportiva id="ROP-003" disponible="true" destacado="true">
            <nombre>Sudadera Entrenamiento</nombre>
            <precio moneda="EUR">39.90</precio>
            <stock>15</stock>
            <fechaRegistro>2025-02-01</fechaRegistro>
            <descripcion>Capa térmica ideal para calentamientos en exterior.</descripcion>
            <especificaciones>
                <tallas>
                    <talla>L</talla>
                    <talla>XL</talla>
                </tallas>
                <material>Algodón y poliéster</material>
            </especificaciones>
        </ropa_deportiva>
        <ropa_deportiva id="ROP-004" disponible="true" destacado="false">
            <nombre>Mallas Fit Pro</nombre>
            <precio moneda="EUR">29.95</precio>
            <stock>22</stock>
            <fechaRegistro>2025-02-01</fechaRegistro>
            <descripcion>Alta elasticidad y costuras planas anti-rozaduras.</descripcion>
            <especificaciones>
                <tallas>
                    <talla>S</talla>
                    <talla>M</talla>
                </tallas>
                <material>Lycra reforzada</material>
            </especificaciones>
        </ropa_deportiva>
        <ropa_deportiva id="ROP-005" disponible="true" destacado="false">
            <nombre>Chaqueta Cortavientos</nombre>
            <precio moneda="EUR">54.99</precio>
            <stock>10</stock>
            <fechaRegistro>2025-02-01</fechaRegistro>
            <descripcion>Protección total contra el viento y lluvia ligera.</descripcion>
            <especificaciones>
                <tallas>
                    <talla>M</talla>
                    <talla>L</talla>
                </tallas>
                <material>Sintético impermeable</material>
            </especificaciones>
        </ropa_deportiva>
        <ropa_deportiva id="ROP-006" disponible="true" destacado="false">
            <nombre>Top Deportivo High Support</nombre>
            <precio moneda="EUR">22.50</precio>
            <stock>18</stock>
            <fechaRegistro>2025-02-01</fechaRegistro>
            <descripcion>Máxima sujeción para deportes de alto impacto.</descripcion>
            <especificaciones>
                <tallas>
                    <talla>S</talla>
                    <talla>M</talla>
                </tallas>
                <material>Elastano y rejilla</material>
            </especificaciones>
        </ropa_deportiva>
        <ropa_deportiva id="ROP-007" disponible="true" destacado="false">